{
  "$schema": "http://json-schema.org/draft-07/schema#",
  "$id": "https://uiforagents.com/schema/registry.schema.json",
  "title": "uiforagents registry item",
  "description": "Manifest for one uiforagents component item: a shadcn registry-item dialect superset for a vanilla HTML/CSS kit. Versioned in this file via \"version\"; no versioned filenames.",
  "version": "2.0.0",
  "type": "object",
  "additionalProperties": false,
  "required": [
    "schemaVersion",
    "name",
    "type",
    "category",
    "title",
    "description",
    "keywords",
    "behavior",
    "props",
    "slots",
    "cssVars",
    "variants",
    "files",
    "docs"
  ],
  "properties": {
    "schemaVersion": {
      "type": "string",
      "description": "Manifest schema version this item conforms to. Anchors cross-repo schema alignment.",
      "pattern": "^\\d+\\.\\d+\\.\\d+$"
    },
    "name": {
      "type": "string",
      "description": "Unique item name, kebab-case. Matches the items/<name>/ folder.",
      "pattern": "^[a-z][a-z0-9-]*$"
    },
    "type": {
      "const": "registry:component"
    },
    "category": {
      "type": "string",
      "description": "Index grouping used by the agent index and docs.",
      "enum": ["actions", "forms", "content", "feedback", "navigation", "data", "overlay", "media"]
    },
    "title": {
      "type": "string",
      "description": "Human-readable short title."
    },
    "description": {
      "type": "string",
      "description": "One-line summary for the agent index; readable without opening any other file."
    },
    "keywords": {
      "type": "array",
      "description": "Free-form search terms.",
      "items": { "type": "string" }
    },
    "behavior": {
      "description": "Behavior model. kind: none (static markup), css-only (state via native inputs and CSS), js-inline (ships a dependency-free script file). contract: data-attribute behavior contract strings framework renderers consume. packages: npm names the behavior needs; empty for css-only and none.",
      "type": "object",
      "additionalProperties": false,
      "required": ["kind", "contract", "packages"],
      "properties": {
        "kind": {
          "enum": ["none", "css-only", "js-inline"]
        },
        "contract": {
          "type": "array",
          "items": { "type": "string" }
        },
        "packages": {
          "type": "array",
          "items": { "type": "string" }
        }
      }
    },
    "props": {
      "type": "array",
      "description": "Codegen props surface. Items with a variant table surface exactly one enum prop named variant whose values are the closed table; items without variants have no variant prop. HTML-attribute passthrough is rest-props and not declared here.",
      "items": {
        "type": "object",
        "additionalProperties": false,
        "required": ["name", "type", "default", "description"],
        "properties": {
          "name": {
            "type": "string",
            "description": "Prop name, lowerCamelCase.",
            "pattern": "^[a-z][a-zA-Z0-9]*$"
          },
          "type": {
            "description": "enum: closed string union in values. boolean: on/off attr or flag. string: free-form text.",
            "enum": ["enum", "boolean", "string"]
          },
          "values": {
            "type": "array",
            "description": "Closed value list for enum props, in manifest order.",
            "items": { "type": "string" }
          },
          "default": {
            "type": ["string", "boolean"],
            "description": "Default value; string for enum and string props, boolean for boolean props."
          },
          "description": {
            "type": "string"
          }
        }
      }
    },
    "slots": {
      "type": "array",
      "description": "Named render positions, mapping [data-uifa-slot] hooks to slot names. The root/children default slot is implicit and not listed.",
      "items": {
        "type": "object",
        "additionalProperties": false,
        "required": ["name", "description"],
        "properties": {
          "name": {
            "type": "string",
            "description": "The data-uifa-slot attribute value.",
            "pattern": "^[a-z][a-z0-9-]*$"
          },
          "description": {
            "type": "string"
          }
        }
      }
    },
    "adapters": {
      "type": "object",
      "description": "Optional framework-adapter support map. Only declared adapters get generated output.",
      "additionalProperties": false,
      "properties": {
        "react": {
          "const": true,
          "description": "A React adapter is generated at adapters/react/<name>.jsx."
        }
      }
    },
    "cssVars": {
      "type": "array",
      "description": "Semantic token roles this item's CSS reads. The kit token vocabulary is the union of cssVars across items plus the base scale declared by themes/index.mjs.",
      "items": {
        "type": "string",
        "pattern": "^--[a-z][a-z0-9-]*$"
      }
    },
    "variants": {
      "type": "array",
      "description": "Closed [data-uifa-variant] table. Empty when the item has no variants.",
      "items": {
        "type": "object",
        "additionalProperties": false,
        "required": ["name", "description"],
        "properties": {
          "name": {
            "type": "string",
            "description": "The data-uifa-variant attribute value.",
            "pattern": "^[a-z][a-z0-9-]*$"
          },
          "default": {
            "type": "boolean",
            "description": "Exactly one variant may set this when the table has a default."
          },
          "description": {
            "type": "string"
          }
        }
      }
    },
    "files": {
      "type": "array",
      "description": "Paths relative to the item folder.",
      "items": {
        "type": "object",
        "additionalProperties": false,
        "required": ["path", "type"],
        "properties": {
          "path": { "type": "string" },
          "type": {
            "enum": ["kit:markup", "kit:style", "kit:behavior", "kit:example", "kit:fixture"]
          }
        }
      }
    },
    "docs": {
      "type": "string",
      "description": "Usage guidance: when to reach for the item, data attributes, token roles."
    },
    "meta": {
      "type": "object",
      "additionalProperties": false,
      "properties": {
        "source": {
          "type": ["string", "null"],
          "description": "Upstream provenance when an item ports third-party work; null for original items."
        }
      }
    }
  }
}
