{
  "schemaVersion": "2.0.0",
  "name": "button",
  "type": "registry:component",
  "category": "actions",
  "title": "Button",
  "description": "Primary, secondary, danger, and compact action buttons with disabled, hover, and focus states.",
  "keywords": ["button", "action", "submit", "cta", "destructive"],
  "behavior": {
    "kind": "none",
    "contract": [],
    "packages": []
  },
  "cssVars": [
    "--uifa-accent",
    "--uifa-accent-fg",
    "--uifa-surface",
    "--uifa-border",
    "--uifa-border-strong",
    "--uifa-text",
    "--uifa-text-muted",
    "--uifa-danger",
    "--uifa-danger-fg",
    "--uifa-faint",
    "--uifa-radius-control",
    "--uifa-border-width",
    "--uifa-font-body",
    "--uifa-text-base",
    "--uifa-space",
    "--uifa-duration",
    "--uifa-ease"
  ],
  "variants": [
    { "name": "primary", "default": true, "description": "Solid accent fill; the main action of a view." },
    { "name": "secondary", "description": "Outlined surface for supporting actions." },
    { "name": "danger", "description": "Destructive actions such as delete or revoke." },
    { "name": "small", "description": "Compact type and padding for dense toolbars; keeps the 44px touch target." }
  ],
  "props": [
    { "name": "variant", "type": "enum", "values": [ "primary", "secondary", "danger", "small" ], "default": "primary", "description": "Visual variant; the closed data-uifa-variant table." },
    { "name": "disabled", "type": "boolean", "default": false, "description": "Native disabled attribute; blocks interaction and dims via tokens." }
  ],
  "slots": [],
  "adapters": { "react": true },
  "files": [
    { "path": "button.html", "type": "kit:markup" },
    { "path": "button.css", "type": "kit:style" },
    { "path": "button.example.html", "type": "kit:example" },
    { "path": "fixture.aria.yml", "type": "kit:fixture" }
  ],
  "docs": "Use `data-uifa-variant` on the button element; omit it for the primary default. Disable with the native `disabled` attribute. Focus rings and hover shades derive from tokens, so no per-theme overrides are needed.",
  "meta": { "source": "original" }
}
