{
  "schemaVersion": "2.0.0",
  "name": "form-field",
  "type": "registry:component",
  "category": "forms",
  "title": "Form field",
  "description": "Label, text input, and textarea with an accent focus ring.",
  "keywords": ["input", "textarea", "text", "form", "field", "label"],
  "behavior": {
    "kind": "none",
    "contract": [],
    "packages": []
  },
  "cssVars": [
    "--uifa-accent",
    "--uifa-surface",
    "--uifa-border",
    "--uifa-border-strong",
    "--uifa-border-width",
    "--uifa-text",
    "--uifa-text-muted",
    "--uifa-faint",
    "--uifa-radius-control",
    "--uifa-font-body",
    "--uifa-text-base",
    "--uifa-space",
    "--uifa-duration",
    "--uifa-ease"
  ],
  "variants": [
    { "name": "text", "default": true, "description": "Single-line input; omit data-uifa-variant." },
    { "name": "textarea", "description": "Multi-line input via `data-uifa-variant=\"textarea\"` on the textarea." }
  ],
  "props": [
    { "name": "variant", "type": "enum", "values": [ "text", "textarea" ], "default": "text", "description": "Control to render: single-line input or multi-line textarea." },
    { "name": "disabled", "type": "boolean", "default": false, "description": "Disables the rendered control." }
  ],
  "slots": [
    { "name": "label", "description": "Visible label text bound to the control." }
  ],
  "adapters": { "react": true },
  "files": [
    { "path": "form-field.html", "type": "kit:markup" },
    { "path": "form-field.css", "type": "kit:style" },
    { "path": "form-field.example.html", "type": "kit:example" },
    { "path": "fixture.aria.yml", "type": "kit:fixture" }
  ],
  "docs": "A wrapping `<label class=\"uifa-field\">` binds the visible label to its control without ids. The focus ring uses the accent role; hover deepens the border. Keep `min-height` at the 44px touch floor on inputs.",
  "meta": { "source": "original" }
}
