{
  "schemaVersion": "2.0.0",
  "name": "card",
  "type": "registry:component",
  "category": "content",
  "title": "Card",
  "description": "Surface card with one radius and theme-defined shadow character.",
  "keywords": ["card", "surface", "panel", "container"],
  "behavior": {
    "kind": "none",
    "contract": [],
    "packages": []
  },
  "cssVars": [
    "--uifa-accent-soft",
    "--uifa-surface",
    "--uifa-border",
    "--uifa-border-strong",
    "--uifa-border-width",
    "--uifa-text",
    "--uifa-text-muted",
    "--uifa-radius-surface",
    "--uifa-shadow-char",
    "--uifa-font-body",
    "--uifa-font-display",
    "--uifa-text-base",
    "--uifa-space"
  ],
  "variants": [],
  "props": [],
  "slots": [
    { "name": "title", "description": "Card heading; renders in the h3." },
    { "name": "body", "description": "Card copy; renders in the p." },
    { "name": "actions", "description": "Action cluster; renders in the trailing div." }
  ],
  "adapters": { "react": true },
  "files": [
    { "path": "card.html", "type": "kit:markup" },
    { "path": "card.css", "type": "kit:style" },
    { "path": "card.example.html", "type": "kit:example" },
    { "path": "fixture.aria.yml", "type": "kit:fixture" }
  ],
  "docs": "One card, one radius, no variant table by design; visual character comes entirely from the theme (`--uifa-surface`, `--uifa-radius-surface`, `--uifa-shadow-char`). Parts: `[data-uifa-slot=\"title\"]`, `[data-uifa-slot=\"body\"]`, `[data-uifa-slot=\"actions\"]`. Compose buttons or badges into the slots.",
  "meta": { "source": "original" }
}
